{
  "schemaVersion": 1,
  "type": "SduiDocument",
  "meta": { "docId": "dashboard:module-boilerplate", "provenance": "module_boilerplate" },
  "root": {
    "type": "Stack",
    "gap": "lg",
    "children": [
      {
        "type": "Text",
        "variant": "heading",
        "content": "模块案例模板 · 当前进展 / 黄金指标 / 产物总结"
      },
      {
        "type": "Text",
        "variant": "body",
        "color": "subtle",
        "content": "这是一个给业务同事复制改造的模块案例模板。模块执行前先打开大盘，再通过会话内 HITL 选择与文件上传推进流程，右侧大盘会根据执行阶段实时更新。"
      },
      {
        "type": "Stepper",
        "id": "stepper-main",
        "steps": [
          {
            "id": "s1",
            "title": "引导与启动",
            "status": "waiting",
            "detail": [
              { "title": "等待进入流程", "status": "waiting" },
              { "title": "助手或用户触发 guide", "status": "waiting" }
            ]
          },
          {
            "id": "s2",
            "title": "策略选择 (HITL)",
            "status": "waiting",
            "detail": [{ "title": "等待会话内选择卡片", "status": "waiting" }]
          },
          {
            "id": "s3",
            "title": "材料上传 (HITL)",
            "status": "waiting",
            "detail": [{ "title": "等待文件上传", "status": "waiting" }]
          },
          {
            "id": "s4",
            "title": "交付总结",
            "status": "waiting",
            "detail": [{ "title": "生成产物与总结", "status": "waiting" }]
          }
        ]
      },
      {
        "type": "Text",
        "variant": "heading",
        "content": "黄金指标"
      },
      {
        "type": "Row",
        "gap": "md",
        "children": [
          {
            "type": "DonutChart",
            "id": "chart-donut",
            "flex": 1,
            "centerLabel": "任务健康度",
            "centerValue": "—",
            "segments": [
              { "label": "已完成", "value": 1, "color": "success" },
              { "label": "待办", "value": 3, "color": "subtle" }
            ]
          },
          {
            "type": "BarChart",
            "id": "chart-bar",
            "flex": 1,
            "valueUnit": "分",
            "data": [
              { "label": "吞吐", "value": 0, "color": "accent" },
              { "label": "质量", "value": 0, "color": "success" },
              { "label": "风险", "value": 0, "color": "warning" }
            ]
          }
        ]
      },
      {
        "type": "Stack",
        "gap": "sm",
        "children": [
          {
            "type": "ChartPlaceholder",
            "id": "chart-gantt-placeholder",
            "variant": "bar",
            "caption": "这里可替换成你们业务自己的可视化：甘特、柱状图、饼图、地图或外部系统页面。只要保留节点 id，就能继续吃到实时 Patch。"
          },
          {
            "type": "Button",
            "id": "btn-open-gantt-browser",
            "label": "在分屏打开示例页面",
            "variant": "outline",
            "action": {
              "kind": "open_preview",
              "path": "browser://https://example.com"
            }
          }
        ]
      },
      {
        "type": "Text",
        "variant": "heading",
        "content": "作业结果"
      },
      {
        "type": "Text",
        "id": "summary-text",
        "variant": "body",
        "color": "subtle",
        "content": "执行 guide/start/choose_strategy/upload_evidence/after_upload/finish 后，此处将展示阶段结论与交付摘要；产物会在下方列表生成，点击后可在右侧预览。"
      },
      {
        "type": "ArtifactGrid",
        "id": "uploaded-files",
        "title": "已上传文件",
        "mode": "input",
        "artifacts": []
      },
      {
        "type": "ArtifactGrid",
        "id": "artifacts",
        "title": "模块产物",
        "mode": "output",
        "artifacts": []
      }
    ]
  }
}
