{
  "schemaVersion": 1,
  "type": "SduiDocument",
  "meta": { "docId": "dashboard:hybrid-demo", "role": "dashboard" },
  "root": {
    "type": "Stack",
    "gap": "md",
    "children": [
      {
        "type": "Card",
        "title": "Hybrid Demo",
        "children": [
          {
            "type": "Stepper",
            "id": "stepper-main",
            "mode": "horizontal",
            "steps": [
              { "id": "hybrid_demo:s1", "label": "启动", "status": "running" },
              { "id": "hybrid_demo:s2", "label": "子任务摘要", "status": "waiting" }
            ]
          },
          {
            "type": "Text",
            "id": "summary-text",
            "variant": "body",
            "color": "subtle",
            "content": "等待运行：请从左侧触发 skill_runtime_start（skillName=hybrid_demo）。"
          },
          {
            "type": "ArtifactGrid",
            "id": "uploaded-files",
            "title": "已上传文件",
            "mode": "input",
            "artifacts": []
          },
          {
            "type": "ArtifactGrid",
            "id": "artifacts",
            "title": "作业结果",
            "mode": "output",
            "artifacts": []
          }
        ]
      }
    ]
  }
}

