{
  "schemaVersion": 1,
  "type": "SduiDocument",
  "meta": { "docId": "dashboard:intelligent-analysis-workbench", "provenance": "intelligent_analysis_workbench" },
  "root": {
    "type": "Stack",
    "gap": "lg",
    "children": [
      {
        "type": "Text",
        "variant": "heading",
        "content": "智能分析工作台 · 当前进展 / 黄金指标 / 产物总结"
      },
      {
        "type": "Text",
        "variant": "body",
        "color": "subtle",
        "content": "本案例用于展示当前 nanobot 已有的完整模块能力：项目阶段引导、HITL 选择、文件上传、并行分析、流式大盘更新和结论产物生成。"
      },
      {
        "type": "Stepper",
        "id": "stepper-main",
        "steps": [
          {
            "id": "s1",
            "title": "项目引导与进入模块",
            "status": "waiting",
            "detail": [{ "title": "等待从项目总览进入", "status": "waiting" }]
          },
          {
            "id": "s2",
            "title": "目标选择 (HITL)",
            "status": "waiting",
            "detail": [{ "title": "等待选择分析目标", "status": "waiting" }]
          },
          {
            "id": "s3",
            "title": "资料上传与预览",
            "status": "waiting",
            "detail": [{ "title": "等待上传分析资料", "status": "waiting" }]
          },
          {
            "id": "s4",
            "title": "并行分析执行",
            "status": "waiting",
            "detail": [{ "title": "等待启动分析 skill", "status": "waiting" }]
          },
          {
            "id": "s5",
            "title": "结论汇总与产物",
            "status": "waiting",
            "detail": [{ "title": "等待生成最终结论", "status": "waiting" }]
          }
        ]
      },
      {
        "type": "Text",
        "variant": "heading",
        "content": "黄金指标"
      },
      {
        "type": "Row",
        "gap": "md",
        "children": [
          {
            "type": "DonutChart",
            "id": "chart-donut",
            "flex": 1,
            "centerLabel": "分析健康度",
            "centerValue": "0%",
            "segments": [
              { "label": "已完成", "value": 0, "color": "success" },
              { "label": "待办", "value": 5, "color": "subtle" }
            ]
          },
          {
            "type": "BarChart",
            "id": "chart-bar",
            "flex": 1,
            "valueUnit": "分",
            "data": [
              { "label": "资料覆盖度", "value": 0, "color": "accent" },
              { "label": "分析就绪度", "value": 0, "color": "success" },
              { "label": "风险信号", "value": 0, "color": "warning" }
            ]
          }
        ]
      },
      {
        "type": "Stack",
        "gap": "sm",
        "children": [
          {
            "type": "ChartPlaceholder",
            "id": "chart-analysis-placeholder",
            "variant": "bar",
            "caption": "这里可以按业务替换成更复杂的分类统计、阶段甘特或项目对比视图。保留稳定节点 id 即可继续吃到 runtime Patch。"
          }
        ]
      },
      {
        "type": "Text",
        "variant": "heading",
        "content": "作业结果"
      },
      {
        "type": "Text",
        "id": "summary-text",
        "variant": "body",
        "color": "subtle",
        "content": "进入模块后，这里会展示阶段性结论、上传概况、并行分析摘要和最终结论；最终产物会挂载到下方产物区。"
      },
      {
        "type": "ArtifactGrid",
        "id": "uploaded-files",
        "title": "已上传文件",
        "mode": "input",
        "artifacts": []
      },
      {
        "type": "ArtifactGrid",
        "id": "artifacts",
        "title": "作业结果",
        "mode": "output",
        "artifacts": []
      }
    ]
  }
}
