{
  "schemaVersion": 1,
  "type": "SduiDocument",
  "meta": { "docId": "dashboard:job-management", "provenance": "job_management" },
  "root": {
    "type": "Stack",
    "gap": "lg",
    "children": [
      {
        "type": "Text",
        "variant": "heading",
        "content": "作业管理 · Skill-First 排期工作台"
      },
      {
        "type": "Text",
        "variant": "body",
        "color": "subtle",
        "content": "模板目标：用一个 Skill 展示平台全能力（HITL 文件上传/选择/确认、SDUI 同步、中栏工作台、右栏产物预览、进度同步）。图二风格工作台由 Skill 网页实现，通过 skill_web_intent 回传。"
      },
      {
        "type": "Row",
        "gap": "md",
        "align": "center",
        "children": [
          {
            "type": "Button",
            "id": "btn-start-skill",
            "label": "启动（进入模板全链路）",
            "variant": "primary",
            "color": "accent",
            "action": {
              "kind": "post_user_message",
              "text": "{\"type\":\"chat_card_intent\",\"verb\":\"skill_runtime_start\",\"payload\":{\"type\":\"skill_runtime_start\",\"skillName\":\"job_management\",\"requestId\":\"req-start-jobm\",\"action\":\"jm_start\"}}"
            }
          }
        ]
      },
      {
        "type": "Stepper",
        "id": "stepper-main",
        "orientation": "horizontal",
        "steps": [
          { "id": "s1", "title": "上传资料（HITL）", "status": "waiting" },
          { "id": "s2", "title": "选择策略（HITL）", "status": "waiting" },
          { "id": "s3", "title": "确认执行（HITL）", "status": "waiting" },
          { "id": "s4", "title": "工作台编辑（Web）", "status": "waiting" },
          { "id": "s5", "title": "发布产物", "status": "waiting" }
        ]
      },

      {
        "type": "EmbeddedWeb",
        "id": "jm-workbench-web",
        "src": "/api/file?path=workspace/skills/job_management/ui/job_workbench.html",
        "minHeight": 720,
        "state": {}
      },
      {
        "type": "Text",
        "variant": "heading",
        "content": "阶段说明"
      },
      {
        "type": "Text",
        "id": "summary-text",
        "variant": "body",
        "color": "subtle",
        "content": "由 Skill driver 同步：上传资料 → 三段排期 → 任务下发。"
      },
      {
        "type": "ArtifactGrid",
        "id": "uploaded-files",
        "title": "已上传文件",
        "mode": "input",
        "artifacts": []
      },
      {
        "type": "ArtifactGrid",
        "id": "artifacts",
        "title": "作业产物",
        "mode": "output",
        "artifacts": []
      }
    ]
  }
}
